{
  "$schema": "https://json-schema.org/draft/2020-12/schema",
  "$id": "rzn.mobile.workflow",
  "title": "RZN Mobile Workflow",
  "type": "object",
  "additionalProperties": false,
  "required": ["name", "version"],
  "properties": {
    "name": {
      "type": "string",
      "minLength": 1
    },
    "version": {
      "type": "string",
      "minLength": 1
    },
    "description": {
      "type": "string"
    },
    "required_variables": {
      "type": "array",
      "items": { "type": "string", "minLength": 1 },
      "uniqueItems": true
    },
    "metadata": {
      "type": "object",
      "additionalProperties": true
    },
    "platforms": {
      "type": "array",
      "items": {
        "type": "string",
        "enum": ["ios", "android"]
      },
      "minItems": 1,
      "uniqueItems": true
    },
    "inputs": {
      "type": "object",
      "additionalProperties": { "$ref": "#/$defs/input_def" }
    },
    "capability": {
      "$ref": "#/$defs/capability"
    },
    "help": {
      "$ref": "#/$defs/help"
    },
    "notes": {
      "type": "array",
      "items": { "type": "string" }
    },
    "steps": {
      "type": "array",
      "items": { "$ref": "#/$defs/step" }
    },
    "output": {
      "type": "object"
    },
    "presentation": {
      "type": "object"
    }
  },
  "$defs": {
    "input_def": {
      "type": "object",
      "additionalProperties": false,
      "required": ["type"],
      "properties": {
        "type": {
          "type": "string",
          "enum": ["string", "integer", "number", "boolean", "object", "array"]
        },
        "required": { "type": "boolean", "default": false },
        "default": {},
        "description": { "type": "string" },
        "example": {},
        "group": {
          "type": "string",
          "enum": ["core", "safety", "advanced", "internal"]
        },
        "min": { "type": "number" },
        "max": { "type": "number" }
      }
    },
    "help_example": {
      "type": "object",
      "additionalProperties": false,
      "properties": {
        "label": { "type": "string" },
        "description": { "type": "string" },
        "args": { "type": "object" }
      }
    },
    "help_parameter": {
      "type": "object",
      "additionalProperties": false,
      "properties": {
        "description": { "type": "string" },
        "example": {},
        "group": {
          "type": "string",
          "enum": ["core", "safety", "advanced", "internal"]
        },
        "structure": { "type": "string" }
      }
    },
    "help": {
      "type": "object",
      "additionalProperties": false,
      "properties": {
        "when_to_use": { "type": "string" },
        "returns": { "type": "string" },
        "parameters": {
          "type": "object",
          "additionalProperties": { "$ref": "#/$defs/help_parameter" }
        },
        "examples": {
          "type": "array",
          "items": { "$ref": "#/$defs/help_example" }
        }
      }
    },
    "capability": {
      "type": "object",
      "additionalProperties": false,
      "required": ["family", "intent", "surface", "mutating"],
      "properties": {
        "family": {
          "type": "string",
          "enum": ["observe", "navigate", "extract", "interact", "verify", "session", "workflow", "utility"]
        },
        "intent": { "type": "string", "minLength": 1 },
        "surface": { "type": "string", "minLength": 1 },
        "mutating": { "type": "boolean" }
      }
    },
    "when": {
      "oneOf": [
        { "type": "boolean" },
        { "type": "string", "minLength": 1 },
        {
          "type": "object",
          "additionalProperties": false,
          "required": ["var"],
          "properties": {
            "var": { "type": "string", "minLength": 1 },
            "equals": {},
            "notEquals": {},
            "exists": { "type": "boolean" },
            "truthy": { "type": "boolean" }
          },
          "oneOf": [
            { "required": ["equals"] },
            { "required": ["notEquals"] },
            { "required": ["exists"] },
            { "required": ["truthy"] }
          ]
        },
        {
          "type": "object",
          "additionalProperties": false,
          "required": ["platform"],
          "properties": {
            "platform": { "type": "string", "enum": ["ios", "android"] }
          }
        }
      ]
    },
    "tool_step": {
      "type": "object",
      "additionalProperties": false,
      "required": ["tool"],
      "properties": {
        "id": { "type": "string" },
        "when": { "$ref": "#/$defs/when" },
        "timeoutMs": { "type": "integer", "minimum": 1 },
        "retries": { "type": "integer", "minimum": 0, "maximum": 10, "default": 0 },
        "requiresCommit": { "type": "boolean" },
        "saveAs": { "type": "string" },
        "tool": { "type": "string", "minLength": 1 },
        "arguments": { "type": "object", "default": {} }
      }
    },
    "step": {
      "$ref": "#/$defs/tool_step"
    }
  }
}
