{
  "name": "linkedin/like_post",
  "version": "1.0.2",
  "description": "Open a LinkedIn feed post and optionally like it (commit-gated).",
  "capability": {
    "family": "interact",
    "intent": "like_post",
    "surface": "native_app",
    "mutating": true
  },
  "inputs": {
    "execute_like": { "type": "boolean", "default": false },
    "post_index": { "type": "integer", "default": 0, "min": 0, "max": 50 },
    "max_feed_scrolls": { "type": "integer", "default": 6, "min": 0, "max": 25 },
    "like_button_predicate": { "type": "string", "default": "name CONTAINS 'Reaction button state' OR label == 'Like' OR name == 'Like'" },
    "maxNodes": { "type": "integer", "default": 240, "min": 80, "max": 420 }
  },
  "notes": [
    "Set args.execute_like=true and run with commit=true to actually tap Like.",
    "When execute_like=false the workflow only opens the target post and captures artifacts.",
    "Like tap is guarded with requiresCommit for agent safety."
  ],
  "steps": [
    { "tool": "ios.appium.ensure", "arguments": {} },
    {
      "tool": "ios.session.create",
      "arguments": {
        "udid": "{{udid}}",
        "kind": "native_app",
        "bundleId": "com.linkedin.LinkedIn",
        "replaceExisting": true,
        "noReset": true,
        "showXcodeLog": "{{showXcodeLog}}",
        "allowProvisioningUpdates": "{{allowProvisioningUpdates}}",
        "allowProvisioningDeviceRegistration": "{{allowProvisioningDeviceRegistration}}",
        "sessionCreateTimeoutMs": "{{sessionCreateTimeoutMs}}",
        "wdaLocalPort": "{{wdaLocalPort}}",
        "wdaLaunchTimeoutMs": "{{wdaLaunchTimeoutMs}}",
        "wdaConnectionTimeoutMs": "{{wdaConnectionTimeoutMs}}",
        "signing": {
          "xcodeOrgId": "{{xcodeOrgId}}",
          "xcodeSigningId": "{{xcodeSigningId}}",
          "updatedWDABundleId": "{{updatedWDABundleId}}"
        }
      }
    },
    { "tool": "ios.app.activate", "arguments": { "bundleId": "com.linkedin.LinkedIn", "terminateFirst": true } },
    { "tool": "util.sleep", "arguments": { "minMs": 3500, "maxMs": 4500 } },
    {
      "tool": "ios.ui.extract_text",
      "saveAs": "menuOverlay",
      "arguments": {
        "query": { "type": "XCUIElementTypeButton", "name": "NavPanelViewControllerScrimViewA11yID", "max": 1 },
        "limit": 1,
        "unique": true,
        "order": "y"
      }
    },
    {
      "tool": "util.list.length",
      "saveAs": "menuOverlayCount",
      "arguments": { "list": "{{steps.menuOverlay.texts}}" }
    },
    {
      "tool": "ios.action.tap",
      "when": { "var": "steps.menuOverlayCount.count", "truthy": true },
      "arguments": { "target": { "using": "accessibility id", "value": "NavPanelViewControllerScrimViewA11yID" } }
    },
    {
      "tool": "ios.ui.extract_text",
      "saveAs": "premiumClose",
      "arguments": {
        "query": { "type": "XCUIElementTypeButton", "name": "LINPremiumFeedFullPageTakeoverUpsellCloseButtonViewA11yID", "max": 1 },
        "limit": 1,
        "unique": true,
        "order": "y"
      }
    },
    {
      "tool": "util.list.length",
      "saveAs": "premiumCloseCount",
      "arguments": { "list": "{{steps.premiumClose.texts}}" }
    },
    {
      "tool": "ios.action.tap",
      "when": { "var": "steps.premiumCloseCount.count", "truthy": true },
      "arguments": { "target": { "using": "accessibility id", "value": "LINPremiumFeedFullPageTakeoverUpsellCloseButtonViewA11yID" } }
    },
    {
      "tool": "ios.ui.extract_text",
      "saveAs": "premiumNoThanks",
      "arguments": {
        "query": { "type": "XCUIElementTypeButton", "name": "LINPremiumFeedFullPageTakeoverUpsellCancelCTAButtonA11yID", "max": 1 },
        "limit": 1,
        "unique": true,
        "order": "y"
      }
    },
    {
      "tool": "util.list.length",
      "saveAs": "premiumNoThanksCount",
      "arguments": { "list": "{{steps.premiumNoThanks.texts}}" }
    },
    {
      "tool": "ios.action.tap",
      "when": { "var": "steps.premiumNoThanksCount.count", "truthy": true },
      "arguments": { "target": { "using": "accessibility id", "value": "LINPremiumFeedFullPageTakeoverUpsellCancelCTAButtonA11yID" } }
    },
    {
      "tool": "ios.ui.extract_text",
      "saveAs": "composeCancel",
      "arguments": {
        "query": { "type": "XCUIElementTypeButton", "name": "13603", "max": 1 },
        "limit": 1,
        "unique": true,
        "order": "y"
      }
    },
    {
      "tool": "util.list.length",
      "saveAs": "composeCancelCount",
      "arguments": { "list": "{{steps.composeCancel.texts}}" }
    },
    {
      "tool": "ios.action.tap",
      "when": { "var": "steps.composeCancelCount.count", "truthy": true },
      "arguments": { "target": { "using": "accessibility id", "value": "13603" } }
    },
    {
      "tool": "ios.ui.extract_text",
      "saveAs": "discardButtons",
      "arguments": {
        "query": { "type": "XCUIElementTypeButton", "labelContains": "Discard", "max": 1 },
        "limit": 1,
        "unique": true,
        "order": "y"
      }
    },
    {
      "tool": "util.list.length",
      "saveAs": "discardButtonsCount",
      "arguments": { "list": "{{steps.discardButtons.texts}}" }
    },
    {
      "tool": "ios.action.tap",
      "when": { "var": "steps.discardButtonsCount.count", "truthy": true },
      "arguments": {
        "target": {
          "using": "-ios predicate string",
          "value": "label CONTAINS 'Discard' OR label CONTAINS 'Delete draft' OR label CONTAINS 'Discard post'"
        }
      }
    },
    {
      "tool": "ios.ui.extract_text",
      "saveAs": "sheetGrabber",
      "arguments": {
        "query": { "type": "XCUIElementTypeButton", "name": "Sheet Grabber", "max": 1 },
        "limit": 1,
        "unique": true,
        "order": "y"
      }
    },
    {
      "tool": "util.list.length",
      "saveAs": "sheetGrabberCount",
      "arguments": { "list": "{{steps.sheetGrabber.texts}}" }
    },
    {
      "tool": "ios.action.tap",
      "when": { "var": "steps.sheetGrabberCount.count", "truthy": true },
      "arguments": { "target": { "using": "accessibility id", "value": "Sheet Grabber" } }
    },
    {
      "tool": "ios.action.wait",
      "arguments": {
        "target": {
          "using": "-ios predicate string",
          "value": "name == 'VoyagerFeed.FeedSDUIView' OR name == 'Home' OR label == 'Home'"
        },
        "timeoutMs": 30000
      },
      "retries": 1
    },
    {
      "tool": "ios.action.scroll_until",
      "arguments": {
        "target": { "using": "-ios predicate string", "value": "{{like_button_predicate}}", "index": "{{post_index}}" },
        "direction": "down",
        "distance": 0.6,
        "maxScrolls": "{{max_feed_scrolls}}",
        "timeoutMs": 60000,
        "settleMs": 350
      }
    },
    {
      "tool": "util.sleep",
      "arguments": { "minMs": 700, "maxMs": 700 }
    },
    { "tool": "ios.ui.screenshot", "arguments": {}, "saveAs": "beforeLikeScreenshot" },
    { "tool": "ios.ui.source", "arguments": {}, "saveAs": "beforeLikeUiSource" },
    { "tool": "ios.ui.observe_compact", "arguments": { "nodeFilter": "all", "maxNodes": "{{maxNodes}}" }, "saveAs": "beforeLikeCompactSnapshot" },
    {
      "tool": "ios.action.tap",
      "when": { "var": "execute_like", "truthy": true },
      "requiresCommit": true,
      "arguments": { "target": { "using": "-ios predicate string", "value": "{{like_button_predicate}}" } }
    },
    {
      "tool": "ios.ui.screenshot",
      "when": { "var": "execute_like", "truthy": true },
      "arguments": {},
      "saveAs": "afterLikeScreenshot"
    }
  ],
  "output": {
    "requestedLike": "{{execute_like}}",
    "beforeLikeScreenshot": "{{steps.beforeLikeScreenshot}}",
    "beforeLikeUiSource": "{{steps.beforeLikeUiSource}}",
    "beforeLikeCompactSnapshot": "{{steps.beforeLikeCompactSnapshot}}",
    "afterLikeScreenshot": "{{steps.afterLikeScreenshot}}"
  }
}
