{
  "name": "reddit/comment_first_post",
  "version": "1.4.3",
  "description": "Open Reddit, scroll to the first commentable text post, draft a comment, and optionally submit it. Skips promoted ads and external link posts, which open the in-app browser instead of a comment thread.",
  "capability": {
    "family": "interact",
    "intent": "comment_post",
    "surface": "native_app",
    "mutating": true
  },
  "inputs": {
    "commentText": { "type": "string", "required": true },
    "execute_comment": { "type": "boolean", "default": false },
    "post_index": { "type": "integer", "default": 0, "min": 0, "max": 40 },
    "post_cell_predicate": { "type": "string", "default": "name CONTAINS 'reddit_feed__post__post_cell' OR label CONTAINS 'reddit_feed__post__post_cell'" },
    "post_open_predicate": { "type": "string", "default": "name CONTAINS 'reddit_feed__post__text_preview'" },
    "post_ready_predicate": { "type": "string", "default": "name CONTAINS 'reddit__comment_composer__comment_text_view' OR name CONTAINS 'reddit_post__post_detail__post_node' OR (type == 'XCUIElementTypeButton' AND (label == 'Close' OR name == 'Close'))" },
    "comment_field_predicate": { "type": "string", "default": "name CONTAINS 'reddit__comment_composer__comment_text_view'" },
    "comment_submit_predicate": { "type": "string", "default": "name CONTAINS 'reddit__comment_composer__reply_button' OR label == 'Reply' OR label == 'Post' OR label == 'Send'" },
    "maxNodes": { "type": "integer", "default": 140, "min": 80, "max": 420 }
  },
  "notes": [
    "Set args.execute_comment=true and run with commit=true to submit the drafted comment.",
    "Default behavior is dry-run draft capture."
  ],
  "steps": [
    { "tool": "ios.appium.ensure", "arguments": {} },
    {
      "tool": "ios.session.create",
      "arguments": {
        "udid": "{{udid}}",
        "kind": "native_app",
        "bundleId": "com.reddit.Reddit",
        "reuseActiveSession": true,
        "replaceExisting": false,
        "noReset": true,
        "showXcodeLog": "{{showXcodeLog}}",
        "allowProvisioningUpdates": "{{allowProvisioningUpdates}}",
        "allowProvisioningDeviceRegistration": "{{allowProvisioningDeviceRegistration}}",
        "sessionCreateTimeoutMs": "{{sessionCreateTimeoutMs}}",
        "wdaLaunchTimeoutMs": "{{wdaLaunchTimeoutMs}}",
        "wdaConnectionTimeoutMs": "{{wdaConnectionTimeoutMs}}",
        "signing": {
          "xcodeOrgId": "{{xcodeOrgId}}",
          "xcodeSigningId": "{{xcodeSigningId}}",
          "updatedWDABundleId": "{{updatedWDABundleId}}"
        }
      }
    },
    { "tool": "ios.app.activate", "arguments": { "bundleId": "com.reddit.Reddit", "terminateFirst": true } },
    { "tool": "ios.ui.source", "arguments": {}, "saveAs": "initialUiSource" },
    {
      "tool": "ios.ui.extract_text",
      "saveAs": "postDetailProbe",
      "arguments": {
        "source": "{{steps.initialUiSource.source}}",
        "query": {
          "type": "XCUIElementTypeOther",
          "nameContains": "reddit_post__post_detail__post_node",
          "max": 5
        },
        "limit": 5,
        "unique": false,
        "order": "y"
      }
    },
    {
      "tool": "ios.action.scroll_until",
      "when": { "var": "steps.postDetailProbe.count", "truthy": false },
      "arguments": {
        "direction": "down",
        "maxScrolls": 10,
        "settleMs": 600,
        "timeoutMs": 40000,
        "target": { "using": "-ios predicate string", "value": "{{post_open_predicate}}" }
      },
      "retries": 1
    },
    {
      "tool": "util.sleep",
      "when": { "var": "steps.postDetailProbe.count", "truthy": false },
      "arguments": { "minMs": 450, "maxMs": 1250 }
    },
    {
      "tool": "ios.action.tap",
      "when": { "var": "steps.postDetailProbe.count", "truthy": false },
      "arguments": {
        "target": { "using": "-ios predicate string", "value": "{{post_open_predicate}}", "index": "{{post_index}}" }
      }
    },
    {
      "tool": "ios.action.wait",
      "when": { "var": "steps.postDetailProbe.count", "truthy": false },
      "arguments": {
        "target": { "using": "-ios predicate string", "value": "{{post_ready_predicate}}" },
        "timeoutMs": 30000
      },
      "retries": 1
    },
    { "tool": "util.sleep", "arguments": { "minMs": 700, "maxMs": 1800 } },
    {
      "tool": "ios.action.wait",
      "arguments": {
        "target": { "using": "-ios predicate string", "value": "{{comment_field_predicate}}" },
        "timeoutMs": 15000
      },
      "retries": 1
    },
    {
      "tool": "ios.action.tap",
      "arguments": {
        "target": { "using": "-ios predicate string", "value": "{{comment_field_predicate}}" }
      }
    },
    { "tool": "util.sleep", "arguments": { "minMs": 400, "maxMs": 900 } },
    {
      "tool": "ios.action.type",
      "arguments": {
        "target": { "using": "-ios predicate string", "value": "{{comment_field_predicate}}" },
        "text": "{{commentText}}",
        "clearFirst": true
      }
    },
    {
      "tool": "ios.action.tap",
      "when": { "var": "execute_comment", "truthy": true },
      "requiresCommit": true,
      "arguments": { "target": { "using": "-ios predicate string", "value": "{{comment_submit_predicate}}" } }
    },
    { "tool": "ios.ui.source", "arguments": {}, "saveAs": "uiSource" },
    {
      "tool": "ios.ui.extract_text",
      "saveAs": "postText",
      "arguments": {
        "query": { "type": "XCUIElementTypeStaticText", "max": 200 },
        "limit": 80,
        "unique": true,
        "order": "y"
      }
    },
    { "tool": "ios.ui.screenshot", "arguments": {}, "saveAs": "screenshot" },
    { "tool": "ios.ui.observe_compact", "arguments": { "nodeFilter": "interactive", "maxNodes": "{{maxNodes}}" }, "saveAs": "compact" }
  ],
  "output": {
    "requestedComment": "{{execute_comment}}",
    "texts": "{{steps.postText.texts}}",
    "textCount": "{{steps.postText.count}}",
    "screenshot": "{{steps.screenshot}}",
    "uiSource": "{{steps.uiSource}}",
    "compactSnapshot": "{{steps.compact}}"
  }
}
