{
  "name": "appstore/version_history",
  "version": "1.0.4",
  "description": "Open an App Store app and extract version history rows (best-effort).",
  "capability": {
    "family": "extract",
    "intent": "version_history",
    "surface": "native_app",
    "mutating": false
  },
  "inputs": {
    "query": { "type": "string", "required": true },
    "result_index": { "type": "integer", "default": 0, "min": 0, "max": 50 },
    "submit_mode": { "type": "string", "default": "keyboard" },
    "limit": { "type": "integer", "default": 15, "min": 1, "max": 50 },
    "maxScrolls": { "type": "integer", "default": 10, "min": 0, "max": 30 },
    "country": { "type": "string" },
    "locale": { "type": "string" }
  },
  "notes": [
    "Read-only workflow.",
    "Uses a best-effort scroll to the What's New / Version History section.",
    "result_index is 0-based (0 = first search result)."
  ],
  "steps": [
    { "tool": "ios.appium.ensure", "arguments": {} },
    {
      "tool": "ios.session.create",
      "arguments": {
        "udid": "{{udid}}",
        "kind": "native_app",
        "bundleId": "com.apple.AppStore",
        "replaceExisting": true,
        "noReset": true,
        "showXcodeLog": "{{showXcodeLog}}",
        "allowProvisioningUpdates": "{{allowProvisioningUpdates}}",
        "allowProvisioningDeviceRegistration": "{{allowProvisioningDeviceRegistration}}",
        "sessionCreateTimeoutMs": "{{sessionCreateTimeoutMs}}",
        "wdaLocalPort": "{{wdaLocalPort}}",
        "wdaLaunchTimeoutMs": "{{wdaLaunchTimeoutMs}}",
        "wdaConnectionTimeoutMs": "{{wdaConnectionTimeoutMs}}",
        "signing": {
          "xcodeOrgId": "{{xcodeOrgId}}",
          "xcodeSigningId": "{{xcodeSigningId}}",
          "updatedWDABundleId": "{{updatedWDABundleId}}"
        }
      }
    },
    {
      "tool": "ios.app.activate",
      "arguments": {
        "bundleId": "com.apple.AppStore",
        "terminateFirst": true
      }
    },
    { "tool": "util.sleep", "arguments": { "minMs": 1500, "maxMs": 1500 } },
    {
      "tool": "ios.action.wait",
      "arguments": {
        "target": { "using": "accessibility id", "value": "AppStore.tabBar.search" },
        "timeoutMs": 30000
      },
      "retries": 1
    },
    {
      "tool": "ios.action.tap",
      "arguments": {
        "target": { "using": "accessibility id", "value": "AppStore.tabBar.search" }
      }
    },
    {
      "tool": "ios.action.tap",
      "arguments": {
        "target": { "using": "accessibility id", "value": "AppStore.searchField" }
      }
    },
    {
      "tool": "ios.action.type",
      "when": { "var": "submit_mode", "equals": "suggestion" },
      "arguments": {
        "target": { "using": "accessibility id", "value": "AppStore.searchField" },
        "text": "{{query}}",
        "clearFirst": true
      }
    },
    {
      "tool": "ios.action.type",
      "when": { "var": "submit_mode", "equals": "keyboard" },
      "arguments": {
        "target": { "using": "accessibility id", "value": "AppStore.searchField" },
        "text": "{{query}}",
        "clearFirst": true,
        "pressEnter": true
      }
    },
    {
      "tool": "ios.ui.extract_text",
      "when": { "var": "submit_mode", "equals": "keyboard" },
      "saveAs": "keyboardHints",
      "arguments": {
        "query": { "type": "XCUIElementTypeCell", "ancestorName": "AppStore.searchHints", "max": 2 },
        "limit": 2,
        "unique": true,
        "order": "y"
      }
    },
    {
      "tool": "util.list.first",
      "when": { "var": "submit_mode", "equals": "keyboard" },
      "saveAs": "keyboardHintFirst",
      "arguments": { "list": "{{steps.keyboardHints.texts}}" }
    },
    {
      "tool": "ios.action.tap",
      "when": { "var": "steps.keyboardHintFirst.found", "truthy": true },
      "arguments": { "target": { "using": "xpath", "value": "//XCUIElementTypeCollectionView[@name='AppStore.searchHints']//XCUIElementTypeCell[1]" } }
    },
    {
      "tool": "ios.action.wait",
      "when": { "var": "submit_mode", "equals": "suggestion" },
      "arguments": {
        "target": { "using": "xpath", "value": "//XCUIElementTypeCollectionView[@name='AppStore.searchHints']//XCUIElementTypeCell[1]" },
        "timeoutMs": 10000
      },
      "retries": 1
    },
    {
      "tool": "ios.action.tap",
      "when": { "var": "submit_mode", "equals": "suggestion" },
      "arguments": { "target": { "using": "xpath", "value": "//XCUIElementTypeCollectionView[@name='AppStore.searchHints']//XCUIElementTypeCell[1]" } }
    },
    {
      "tool": "ios.action.wait",
      "arguments": {
        "target": { "using": "xpath", "value": "//XCUIElementTypeCell[starts-with(@name, 'AppStore.shelfItem.searchResult')]" },
        "timeoutMs": 30000
      },
      "retries": 1
    },
    {
      "tool": "ios.ui.extract_rows",
      "saveAs": "searchResults",
      "arguments": {
        "row": {
          "type": "XCUIElementTypeCell",
          "namePrefix": "AppStore.shelfItem.searchResult"
        },
        "primary": {
          "type": "XCUIElementTypeButton",
          "attr": "label",
          "pick": "longest"
        },
        "split": {
          "delimiter": ",",
          "fields": ["name", "subtitle", "developer"],
          "skipMetricLike": true
        },
        "limit": 12
      }
    },
    {
      "tool": "util.rank_by_name",
      "saveAs": "targetResultRank",
      "arguments": {
        "items": "{{steps.searchResults.rows}}",
        "field": "name",
        "target": "{{query}}"
      }
    },
    {
      "tool": "util.list.nth",
      "when": { "var": "steps.targetResultRank.rank", "exists": true },
      "saveAs": "selectedTargetResult",
      "arguments": {
        "list": "{{steps.searchResults.rows}}",
        "index": "{{steps.targetResultRank.rank}}"
      }
    },
    {
      "tool": "ios.action.tap",
      "when": { "var": "steps.selectedTargetResult.found", "truthy": true },
      "arguments": {
        "point": {
          "x": "{{steps.selectedTargetResult.value.tapX}}",
          "y": "{{steps.selectedTargetResult.value.tapY}}"
        }
      }
    },
    {
      "tool": "ios.action.tap",
      "when": { "var": "steps.selectedTargetResult.found", "truthy": false },
      "arguments": {
        "target": { "using": "xpath", "value": "//XCUIElementTypeCell[starts-with(@name, 'AppStore.shelfItem.searchResult')]", "index": "{{result_index}}" }
      }
    },
    {
      "tool": "ios.ui.extract_text",
      "saveAs": "dismissButtons",
      "arguments": {
        "query": { "type": "XCUIElementTypeButton", "name": "AppStore.dismissButton", "max": 2 },
        "limit": 2,
        "unique": true,
        "order": "y"
      }
    },
    {
      "tool": "util.list.first",
      "saveAs": "dismissFirst",
      "arguments": { "list": "{{steps.dismissButtons.texts}}" }
    },
    {
      "tool": "ios.action.tap",
      "when": { "var": "steps.dismissFirst.found", "truthy": true },
      "arguments": { "target": { "using": "accessibility id", "value": "AppStore.dismissButton" } }
    },
    {
      "tool": "ios.action.tap",
      "when": { "var": "steps.dismissFirst.found", "truthy": true },
      "arguments": {
        "point": {
          "x": "{{steps.selectedTargetResult.value.tapX}}",
          "y": "{{steps.selectedTargetResult.value.tapY}}"
        }
      }
    },
    {
      "tool": "ios.action.wait",
      "arguments": {
        "target": { "using": "xpath", "value": "//XCUIElementTypeCell[starts-with(@name, 'AppStore.shelfItem.productTopLockup')]" },
        "timeoutMs": 30000
      },
      "retries": 1
    },
    {
      "tool": "ios.action.scroll_until",
      "arguments": {
        "target": { "using": "-ios predicate string", "value": "name CONTAINS 'parentId=mostRecentVersion'" },
        "direction": "down",
        "distance": 0.6,
        "maxScrolls": "{{maxScrolls}}",
        "timeoutMs": 60000,
        "settleMs": 450
      }
    },
    {
      "tool": "ios.action.tap",
      "arguments": {
        "target": { "using": "-ios predicate string", "value": "name CONTAINS 'parentId=mostRecentVersion'" }
      }
    },
    {
      "tool": "ios.ui.extract_rows",
      "saveAs": "versions",
      "arguments": {
        "row": {
          "type": "XCUIElementTypeCell",
          "ancestorName": "AppStore.versionHistory"
        },
        "primary": {
          "type": "XCUIElementTypeCell",
          "attr": "name",
          "pick": "first"
        },
        "split": {
          "delimiter": ",",
          "fields": ["version", "date", "notes"],
          "skipMetricLike": false
        },
        "limit": "{{limit}}",
        "maxScrolls": "{{maxScrolls}}",
        "scroll": { "direction": "down", "distance": 0.6, "settleMs": 350 },
        "order": "y"
      }
    },
    { "tool": "ios.ui.source", "arguments": {}, "saveAs": "uiSource" },
    { "tool": "ios.ui.screenshot", "arguments": {}, "saveAs": "screenshot" }
  ],
  "output": {
    "query": "{{query}}",
    "result_index": "{{result_index}}",
    "matchedResultRank": "{{steps.targetResultRank.rank}}",
    "matchedResultIndex": "{{steps.targetResultRank.index}}",
    "selectedResult": "{{steps.selectedTargetResult.value}}",
    "versions": "{{steps.versions.rows}}",
    "versionCount": "{{steps.versions.rowCount}}",
    "uiSource": "{{steps.uiSource}}",
    "screenshot": "{{steps.screenshot}}"
  }
}
