{
  "name": "x/open_inbox",
  "version": "1.0.1",
  "description": "Open the native X DM/X Chat inbox and report whether passcode onboarding blocks access.",
  "capability": {
    "family": "navigate",
    "intent": "open_inbox",
    "surface": "native_app",
    "mutating": false
  },
  "inputs": {
    "max_visible_threads": { "type": "integer", "default": 20, "min": 1, "max": 60 },
    "maxNodes": { "type": "integer", "default": 240, "min": 80, "max": 420 }
  },
  "notes": [
    "Read-only workflow.",
    "When X Chat passcode setup is active, the workflow succeeds with gate metadata instead of attempting to open a thread."
  ],
  "steps": [
    { "tool": "ios.appium.ensure", "arguments": {} },
    {
      "tool": "ios.session.create",
      "arguments": {
        "udid": "{{udid}}",
        "kind": "native_app",
        "bundleId": "com.atebits.Tweetie2",
        "replaceExisting": true,
        "noReset": true,
        "showXcodeLog": "{{showXcodeLog}}",
        "allowProvisioningUpdates": "{{allowProvisioningUpdates}}",
        "allowProvisioningDeviceRegistration": "{{allowProvisioningDeviceRegistration}}",
        "sessionCreateTimeoutMs": "{{sessionCreateTimeoutMs}}",
        "wdaLocalPort": "{{wdaLocalPort}}",
        "wdaLaunchTimeoutMs": "{{wdaLaunchTimeoutMs}}",
        "wdaConnectionTimeoutMs": "{{wdaConnectionTimeoutMs}}",
        "signing": {
          "xcodeOrgId": "{{xcodeOrgId}}",
          "xcodeSigningId": "{{xcodeSigningId}}",
          "updatedWDABundleId": "{{updatedWDABundleId}}"
        }
      }
    },
    {
      "tool": "ios.app.activate",
      "arguments": {
        "bundleId": "com.atebits.Tweetie2",
        "terminateFirst": true
      }
    },
    { "tool": "util.sleep", "arguments": { "minMs": 1500, "maxMs": 1500 } },
    {
      "tool": "ios.ui.extract_text",
      "saveAs": "slideshowClose",
      "arguments": {
        "query": { "type": "XCUIElementTypeButton", "name": "CloseButton", "max": 1 },
        "limit": 1,
        "unique": true,
        "order": "y"
      }
    },
    {
      "tool": "util.list.length",
      "saveAs": "slideshowCloseCount",
      "arguments": { "list": "{{steps.slideshowClose.texts}}" }
    },
    {
      "tool": "ios.action.tap",
      "when": { "var": "steps.slideshowCloseCount.count", "truthy": true },
      "arguments": { "target": { "using": "accessibility id", "value": "CloseButton" } }
    },
    {
      "tool": "util.sleep",
      "when": { "var": "steps.slideshowCloseCount.count", "truthy": true },
      "arguments": { "minMs": 900, "maxMs": 900 }
    },
    {
      "tool": "ios.ui.extract_text",
      "saveAs": "timelineBack",
      "arguments": {
        "query": { "type": "XCUIElementTypeButton", "name": "Timeline", "max": 1 },
        "limit": 1,
        "unique": true,
        "order": "y"
      }
    },
    {
      "tool": "util.list.length",
      "saveAs": "timelineBackCount",
      "arguments": { "list": "{{steps.timelineBack.texts}}" }
    },
    {
      "tool": "ios.action.tap",
      "when": { "var": "steps.timelineBackCount.count", "truthy": true },
      "arguments": { "target": { "using": "accessibility id", "value": "Timeline" } }
    },
    {
      "tool": "util.sleep",
      "when": { "var": "steps.timelineBackCount.count", "truthy": true },
      "arguments": { "minMs": 1100, "maxMs": 1100 }
    },
    {
      "tool": "ios.ui.extract_text",
      "saveAs": "composeCancel",
      "arguments": {
        "query": { "type": "XCUIElementTypeButton", "name": "Cancel", "max": 1 },
        "limit": 1,
        "unique": true,
        "order": "y"
      }
    },
    {
      "tool": "util.list.length",
      "saveAs": "composeCancelCount",
      "arguments": { "list": "{{steps.composeCancel.texts}}" }
    },
    {
      "tool": "ios.action.tap",
      "when": { "var": "steps.composeCancelCount.count", "truthy": true },
      "arguments": { "target": { "using": "accessibility id", "value": "Cancel" } }
    },
    {
      "tool": "util.sleep",
      "when": { "var": "steps.composeCancelCount.count", "truthy": true },
      "arguments": { "minMs": 800, "maxMs": 800 }
    },
    {
      "tool": "ios.ui.extract_text",
      "saveAs": "saveDraftPrompt",
      "arguments": {
        "query": { "type": "XCUIElementTypeButton", "labelContains": "Save", "max": 1 },
        "limit": 1,
        "unique": true,
        "order": "y"
      }
    },
    {
      "tool": "util.list.length",
      "saveAs": "saveDraftPromptCount",
      "arguments": { "list": "{{steps.saveDraftPrompt.texts}}" }
    },
    {
      "tool": "ios.action.tap",
      "when": { "var": "steps.saveDraftPromptCount.count", "truthy": true },
      "arguments": {
        "target": {
          "using": "-ios predicate string",
          "value": "type == 'XCUIElementTypeButton' AND (label CONTAINS[c] 'Save' OR name CONTAINS[c] 'Save')"
        }
      }
    },
    {
      "tool": "util.sleep",
      "when": { "var": "steps.saveDraftPromptCount.count", "truthy": true },
      "arguments": { "minMs": 1000, "maxMs": 1000 }
    },
    {
      "tool": "ios.ui.extract_text",
      "saveAs": "dmTabVisible",
      "arguments": {
        "query": { "type": "XCUIElementTypeOther", "name": "DM_tab", "max": 1 },
        "limit": 1,
        "unique": true,
        "order": "y"
      }
    },
    {
      "tool": "util.list.length",
      "saveAs": "dmTabVisibleCount",
      "arguments": { "list": "{{steps.dmTabVisible.texts}}" }
    },
    {
      "tool": "ios.action.tap",
      "when": { "var": "steps.dmTabVisibleCount.count", "truthy": true },
      "arguments": { "point": { "x": 337, "y": 754 } }
    },
    { "tool": "util.sleep", "arguments": { "minMs": 2200, "maxMs": 2200 } },
    {
      "tool": "ios.ui.extract_text",
      "saveAs": "passcodeHeader",
      "arguments": {
        "query": {
          "type": "XCUIElementTypeStaticText",
          "labelContains": "Welcome to the new X Chat",
          "max": 1
        },
        "limit": 1,
        "unique": true,
        "order": "y"
      }
    },
    {
      "tool": "util.list.length",
      "saveAs": "passcodeHeaderCount",
      "arguments": { "list": "{{steps.passcodeHeader.texts}}" }
    },
    {
      "tool": "ios.ui.extract_text",
      "saveAs": "passcodeCreate",
      "arguments": {
        "query": { "type": "XCUIElementTypeButton", "labelContains": "Create Passcode", "max": 1 },
        "limit": 1,
        "unique": true,
        "order": "y"
      }
    },
    {
      "tool": "util.list.length",
      "saveAs": "passcodeCreateCount",
      "arguments": { "list": "{{steps.passcodeCreate.texts}}" }
    },
    {
      "tool": "ios.ui.extract_text",
      "saveAs": "managedPasscodeOption",
      "arguments": {
        "query": {
          "type": "XCUIElementTypeButton",
          "labelContains": "manage my passcode",
          "max": 1
        },
        "limit": 1,
        "unique": true,
        "order": "y"
      }
    },
    {
      "tool": "ios.ui.extract_rows",
      "when": { "var": "steps.passcodeHeaderCount.count", "truthy": false },
      "saveAs": "threadListRows",
      "arguments": {
        "row": { "type": "XCUIElementTypeCell" },
        "primary": {
          "type": "XCUIElementTypeCell",
          "attr": "label",
          "pick": "first"
        },
        "fields": [
          {
            "name": "threadId",
            "query": { "type": "XCUIElementTypeCell", "max": 1 },
            "attr": "name",
            "pick": "first"
          }
        ],
        "limit": "{{max_visible_threads}}",
        "order": "y"
      }
    },
    { "tool": "ios.ui.screenshot", "arguments": {}, "saveAs": "inboxScreenshot" },
    { "tool": "ios.ui.source", "arguments": {}, "saveAs": "inboxUiSource" },
    {
      "tool": "ios.ui.observe_compact",
      "arguments": { "nodeFilter": "all", "maxNodes": "{{maxNodes}}" },
      "saveAs": "inboxCompactSnapshot"
    }
  ],
  "output": {
    "passcodeGateCount": "{{steps.passcodeHeaderCount.count}}",
    "passcodeHeaderTexts": "{{steps.passcodeHeader.texts}}",
    "passcodeCreateTexts": "{{steps.passcodeCreate.texts}}",
    "managedPasscodeOptionTexts": "{{steps.managedPasscodeOption.texts}}",
    "threadListRows": "{{steps.threadListRows.rows}}",
    "threadListRowCount": "{{steps.threadListRows.rowCount}}",
    "inboxScreenshot": "{{steps.inboxScreenshot}}",
    "inboxUiSource": "{{steps.inboxUiSource}}",
    "inboxCompactSnapshot": "{{steps.inboxCompactSnapshot}}"
  }
}
