{
  "name": "instagram/comment_post",
  "version": "1.0.2",
  "description": "Open a visible Instagram post, draft a comment, and optionally submit it with commit gating.",
  "capability": {
    "family": "interact",
    "intent": "comment_post",
    "surface": "native_app",
    "mutating": true
  },
  "inputs": {
    "comment_text": { "type": "string", "required": true },
    "execute_comment": { "type": "boolean", "default": false },
    "post_position": { "type": "integer", "default": 1, "min": 1, "max": 4 },
    "comment_field_predicate": { "type": "string", "default": "type == 'XCUIElementTypeTextView' AND (name == 'text-view' OR label CONTAINS[c] 'Add a comment' OR value CONTAINS[c] 'Add a comment')" },
    "send_button_predicate": { "type": "string", "default": "type == 'XCUIElementTypeButton' AND name == 'send-button'" },
    "maxNodes": { "type": "integer", "default": 240, "min": 80, "max": 420 }
  },
  "notes": [
    "Dry-run by default.",
    "The workflow first normalizes back to a visible Home feed surface because Instagram keeps hidden off-screen trees mounted and they can fool naive waits.",
    "The workflow enters the comments sheet via the visible feed comment button, drafts text, and only posts when execute_comment=true and commit=true."
  ],
  "steps": [
    { "tool": "ios.appium.ensure", "arguments": {} },
    {
      "tool": "ios.session.create",
      "arguments": {
        "udid": "{{udid}}",
        "kind": "native_app",
        "bundleId": "com.burbn.instagram",
        "replaceExisting": true,
        "noReset": true,
        "showXcodeLog": "{{showXcodeLog}}",
        "allowProvisioningUpdates": "{{allowProvisioningUpdates}}",
        "allowProvisioningDeviceRegistration": "{{allowProvisioningDeviceRegistration}}",
        "sessionCreateTimeoutMs": "{{sessionCreateTimeoutMs}}",
        "wdaLocalPort": "{{wdaLocalPort}}",
        "wdaLaunchTimeoutMs": "{{wdaLaunchTimeoutMs}}",
        "wdaConnectionTimeoutMs": "{{wdaConnectionTimeoutMs}}",
        "signing": {
          "xcodeOrgId": "{{xcodeOrgId}}",
          "xcodeSigningId": "{{xcodeSigningId}}",
          "updatedWDABundleId": "{{updatedWDABundleId}}"
        }
      }
    },
    {
      "tool": "ios.app.activate",
      "arguments": {
        "bundleId": "com.burbn.instagram",
        "terminateFirst": true
      }
    },
    { "tool": "util.sleep", "arguments": { "minMs": 1200, "maxMs": 1200 } },
    {
      "tool": "ios.ui.extract_text",
      "saveAs": "visibleBack1",
      "arguments": {
        "query": {
          "type": "XCUIElementTypeButton",
          "label": "Back",
          "max": 1,
          "visibleOnly": true
        },
        "limit": 1,
        "unique": true,
        "order": "y"
      }
    },
    {
      "tool": "util.list.length",
      "saveAs": "visibleBackCount1",
      "arguments": { "list": "{{steps.visibleBack1.texts}}" }
    },
    {
      "tool": "ios.action.tap",
      "when": { "var": "steps.visibleBackCount1.count", "truthy": true },
      "arguments": {
        "target": {
          "using": "-ios predicate string",
          "value": "type == 'XCUIElementTypeButton' AND (label == 'Back' OR name == 'Back')"
        }
      }
    },
    {
      "tool": "util.sleep",
      "when": { "var": "steps.visibleBackCount1.count", "truthy": true },
      "arguments": { "minMs": 900, "maxMs": 900 }
    },
    {
      "tool": "ios.ui.extract_text",
      "saveAs": "visibleBack2",
      "arguments": {
        "query": {
          "type": "XCUIElementTypeButton",
          "label": "Back",
          "max": 1,
          "visibleOnly": true
        },
        "limit": 1,
        "unique": true,
        "order": "y"
      }
    },
    {
      "tool": "util.list.length",
      "saveAs": "visibleBackCount2",
      "arguments": { "list": "{{steps.visibleBack2.texts}}" }
    },
    {
      "tool": "ios.action.tap",
      "when": { "var": "steps.visibleBackCount2.count", "truthy": true },
      "arguments": {
        "target": {
          "using": "-ios predicate string",
          "value": "type == 'XCUIElementTypeButton' AND (label == 'Back' OR name == 'Back')"
        }
      }
    },
    {
      "tool": "util.sleep",
      "when": { "var": "steps.visibleBackCount2.count", "truthy": true },
      "arguments": { "minMs": 900, "maxMs": 900 }
    },
    {
      "tool": "ios.ui.extract_text",
      "saveAs": "visibleHomeTab",
      "arguments": {
        "query": {
          "type": "XCUIElementTypeButton",
          "name": "mainfeed-tab",
          "max": 1,
          "visibleOnly": true
        },
        "limit": 1,
        "unique": true,
        "order": "y"
      }
    },
    {
      "tool": "util.list.length",
      "saveAs": "visibleHomeTabCount",
      "arguments": { "list": "{{steps.visibleHomeTab.texts}}" }
    },
    {
      "tool": "ios.action.tap",
      "when": { "var": "steps.visibleHomeTabCount.count", "truthy": true },
      "arguments": {
        "target": { "using": "accessibility id", "value": "mainfeed-tab" }
      }
    },
    { "tool": "util.sleep", "arguments": { "minMs": 900, "maxMs": 900 } },
    {
      "tool": "ios.action.scroll",
      "arguments": { "direction": "down", "distance": 0.22 }
    },
    { "tool": "util.sleep", "arguments": { "minMs": 850, "maxMs": 850 } },
    {
      "tool": "ios.ui.extract_rows",
      "saveAs": "feedRows",
      "arguments": {
        "row": {
          "type": "XCUIElementTypeCell",
          "name": "media-cell",
          "ancestorName": "main-feed"
        },
        "primary": {
          "type": "XCUIElementTypeOther",
          "attr": "value",
          "pick": "longest"
        },
        "fields": [
          {
            "name": "username",
            "query": {
              "type": "XCUIElementTypeButton",
              "name": "feed-item-header-user-button",
              "max": 1
            },
            "attr": "label",
            "pick": "first"
          }
        ],
        "visibleOnly": true,
        "limit": 4,
        "order": "y"
      }
    },
    {
      "tool": "util.list.nth",
      "saveAs": "selectedPost",
      "arguments": { "list": "{{steps.feedRows.rows}}", "index": "{{post_position}}" }
    },
    {
      "tool": "ios.ui.extract_rows",
      "saveAs": "visibleCommentButtons",
      "arguments": {
        "row": {
          "type": "XCUIElementTypeButton",
          "label": "Comment"
        },
        "primary": {
          "type": "XCUIElementTypeButton",
          "attr": "label",
          "pick": "first"
        },
        "visibleOnly": true,
        "limit": 4,
        "order": "y"
      }
    },
    {
      "tool": "util.list.nth",
      "saveAs": "selectedCommentButton",
      "arguments": {
        "list": "{{steps.visibleCommentButtons.rows}}",
        "index": "{{post_position}}"
      }
    },
    {
      "tool": "ios.action.tap",
      "arguments": {
        "point": {
          "x": "{{steps.selectedCommentButton.value.tapX}}",
          "y": "{{steps.selectedCommentButton.value.tapY}}"
        }
      }
    },
    { "tool": "util.sleep", "arguments": { "minMs": 1800, "maxMs": 1800 } },
    {
      "tool": "ios.action.wait",
      "arguments": {
        "target": { "using": "-ios predicate string", "value": "{{comment_field_predicate}}" },
        "timeoutMs": 15000
      },
      "retries": 1
    },
    {
      "tool": "ios.action.type",
      "arguments": {
        "target": { "using": "-ios predicate string", "value": "{{comment_field_predicate}}" },
        "text": "{{comment_text}}",
        "clearFirst": true
      }
    },
    { "tool": "ios.ui.screenshot", "arguments": {}, "saveAs": "draftCommentScreenshot" },
    { "tool": "ios.ui.source", "arguments": {}, "saveAs": "draftCommentUiSource" },
    {
      "tool": "ios.ui.observe_compact",
      "arguments": { "nodeFilter": "all", "maxNodes": "{{maxNodes}}" },
      "saveAs": "draftCommentCompactSnapshot"
    },
    {
      "tool": "ios.ui.extract_text",
      "saveAs": "sendButtonVisible",
      "arguments": {
        "query": { "type": "XCUIElementTypeButton", "name": "send-button", "max": 2 },
        "visibleOnly": true,
        "limit": 2,
        "unique": true,
        "order": "y"
      }
    },
    {
      "tool": "util.list.length",
      "saveAs": "sendButtonVisibleCount",
      "arguments": { "list": "{{steps.sendButtonVisible.texts}}" }
    },
    {
      "tool": "ios.action.tap",
      "when": { "var": "execute_comment", "truthy": true },
      "requiresCommit": true,
      "arguments": { "target": { "using": "-ios predicate string", "value": "{{send_button_predicate}}" } }
    },
    {
      "tool": "ios.ui.screenshot",
      "when": { "var": "execute_comment", "truthy": true },
      "arguments": {},
      "saveAs": "afterCommentScreenshot"
    }
  ],
  "output": {
    "requestedComment": "{{execute_comment}}",
    "selectedPost": "{{steps.selectedPost.value}}",
    "selectedPostIndex": "{{steps.selectedCommentButton.value.position}}",
    "sendButtonVisibleCount": "{{steps.sendButtonVisibleCount.count}}",
    "screenshot": "{{steps.draftCommentScreenshot}}",
    "uiSource": "{{steps.draftCommentUiSource}}",
    "compactSnapshot": "{{steps.draftCommentCompactSnapshot}}",
    "afterCommentScreenshot": "{{steps.afterCommentScreenshot}}"
  }
}
